<?xml version="1.0" encoding="UTF-8"?>
<configurations xmlns="http://www.w3schools.com"
                xmlns:xsi="http://www.w3.org/2001/XMLSchema-instance"
                xsi:schemaLocation="Config.xsd ../../main/resources/Config.xsd">
    <configuration>
        <type>COUNTER</type>
        <metricName>com.zhaiyi.metrics_feedback.test.XmlConfigurationTest.counter</metricName>
        <initialDelay>0</initialDelay>
        <period>1</period>
        <timeUnit>SECONDS</timeUnit>
        <action>com.zhaiyi.metrics_feedback.test.xml.action.CounterAction</action>
        <thresholds>
            <threshold>
                <name>count</name>
                <min>0</min>
                <max>10</max>
            </threshold>

            <threshold>
                <name>count</name>
                <!--<min>0</min>-->
                <max>10</max>
            </threshold>
        </thresholds>
    </configuration>

</configurations>